[2025-06-15 11:54:58] Ether / IP / TCP 192.168.29.92:49823 > 20.190.145.143:https PA / Raw
[2025-06-15 11:54:58] Ether / IP / TCP 20.190.145.143:https > 192.168.29.92:49823 PA / Raw
[2025-06-15 11:54:58] Ether / IP / TCP 192.168.29.92:49823 > 20.190.145.143:https PA / Raw
[2025-06-15 11:54:58] Ether / IP / TCP 192.168.29.92:49823 > 20.190.145.143:https A / Raw
[2025-06-15 11:54:58] Ether / IP / TCP 192.168.29.92:49823 > 20.190.145.143:https A / Raw
[2025-06-15 11:54:58] Ether / IP / TCP 192.168.29.92:49823 > 20.190.145.143:https A / Raw
[2025-06-15 11:54:58] Ether / IP / TCP 192.168.29.92:49823 > 20.190.145.143:https A / Raw
[2025-06-15 11:54:58] Ether / IP / TCP 192.168.29.92:49823 > 20.190.145.143:https PA / Raw
[2025-06-15 11:54:58] Ether / IP / TCP 20.190.145.143:https > 192.168.29.92:49823 A
[2025-06-15 11:54:58] Ether / IP / TCP 192.168.29.92:49818 > 40.79.167.8:https PA / Raw
[2025-06-15 11:54:58] Ether / IP / TCP 192.168.29.92:49818 > 40.79.167.8:https PA / Raw
[2025-06-15 11:54:58] Ether / IP / TCP 40.79.167.8:https > 192.168.29.92:49818 A
[2025-06-15 11:54:58] Ether / IP / TCP 40.79.167.8:https > 192.168.29.92:49818 PA / Raw
[2025-06-15 11:54:58] Ether / IP / TCP 192.168.29.92:49818 > 40.79.167.8:https A
[2025-06-15 11:54:58] Ether / IP / TCP 20.190.145.143:https > 192.168.29.92:49823 A / Raw
[2025-06-15 11:54:58] Ether / IP / TCP 20.190.145.143:https > 192.168.29.92:49823 A / Raw
[2025-06-15 11:54:58] Ether / IP / TCP 192.168.29.92:49823 > 20.190.145.143:https A
[2025-06-15 11:54:58] Ether / IP / TCP 20.190.145.143:https > 192.168.29.92:49823 A / Raw
[2025-06-15 11:54:58] Ether / IP / TCP 20.190.145.143:https > 192.168.29.92:49823 A / Raw
[2025-06-15 11:54:58] Ether / IP / TCP 192.168.29.92:49823 > 20.190.145.143:https A
[2025-06-15 11:54:58] Ether / IP / TCP 20.190.145.143:https > 192.168.29.92:49823 A / Raw
[2025-06-15 11:54:58] Ether / IP / TCP 20.190.145.143:https > 192.168.29.92:49823 A / Raw
[2025-06-15 11:54:58] Ether / IP / TCP 192.168.29.92:49823 > 20.190.145.143:https A
[2025-06-15 11:54:58] Ether / IP / TCP 20.190.145.143:https > 192.168.29.92:49823 A / Raw
[2025-06-15 11:54:58] Ether / IP / TCP 20.190.145.143:https > 192.168.29.92:49823 A / Raw
[2025-06-15 11:54:58] Ether / IP / TCP 192.168.29.92:49823 > 20.190.145.143:https A
[2025-06-15 11:54:58] Ether / IP / TCP 20.190.145.143:https > 192.168.29.92:49823 A / Raw
[2025-06-15 11:54:58] Ether / IP / TCP 20.190.145.143:https > 192.168.29.92:49823 A / Raw
[2025-06-15 11:54:58] Ether / IP / TCP 192.168.29.92:49823 > 20.190.145.143:https A
[2025-06-15 11:54:58] Ether / IP / TCP 20.190.145.143:https > 192.168.29.92:49823 A / Raw
[2025-06-15 11:54:58] Ether / IP / TCP 20.190.145.143:https > 192.168.29.92:49823 A / Raw
[2025-06-15 11:54:58] Ether / IP / TCP 192.168.29.92:49823 > 20.190.145.143:https A
[2025-06-15 11:54:58] Ether / IP / TCP 20.190.145.143:https > 192.168.29.92:49823 A / Raw
[2025-06-15 11:54:58] Ether / IP / TCP 20.190.145.143:https > 192.168.29.92:49823 A / Raw
[2025-06-15 11:54:58] Ether / IP / TCP 20.190.145.143:https > 192.168.29.92:49823 PA / Raw
[2025-06-15 11:54:58] Ether / IP / TCP 192.168.29.92:49823 > 20.190.145.143:https A
[2025-06-15 11:54:59] Ether / 192.168.29.92 > 224.0.0.22 2 / Raw
[2025-06-15 11:54:59] Ether / IP / TCP 192.168.29.92:49823 > 20.190.145.143:https PA / Raw
[2025-06-15 11:54:59] Ether / IP / TCP 192.168.29.92:49823 > 20.190.145.143:https A / Raw
[2025-06-15 11:54:59] Ether / IP / TCP 192.168.29.92:49823 > 20.190.145.143:https A / Raw
[2025-06-15 11:54:59] Ether / IP / TCP 192.168.29.92:49823 > 20.190.145.143:https A / Raw
[2025-06-15 11:54:59] Ether / IP / TCP 192.168.29.92:49823 > 20.190.145.143:https A / Raw
[2025-06-15 11:54:59] Ether / IP / TCP 192.168.29.92:49823 > 20.190.145.143:https PA / Raw
[2025-06-15 11:54:59] Ether / IP / TCP 20.190.145.143:https > 192.168.29.92:49823 A
[2025-06-15 11:54:59] Ether / IP / TCP 20.190.145.143:https > 192.168.29.92:49823 A
[2025-06-15 11:54:59] Ether / IP / TCP 20.190.145.143:https > 192.168.29.92:49823 A / Raw
[2025-06-15 11:54:59] Ether / IP / TCP 192.168.29.92:49823 > 20.190.145.143:https A
[2025-06-15 11:54:59] Ether / IP / TCP 20.190.145.143:https > 192.168.29.92:49823 A / Raw
[2025-06-15 11:54:59] Ether / IP / TCP 20.190.145.143:https > 192.168.29.92:49823 PA / Raw
[2025-06-15 11:54:59] Ether / IP / TCP 192.168.29.92:49823 > 20.190.145.143:https A
[2025-06-15 11:54:59] Ether / IP / TCP 192.168.29.92:49821 > 204.79.197.203:https FA
[2025-06-15 11:54:59] Ether / IP / TCP 192.168.29.92:49817 > 204.79.197.203:https FA
[2025-06-15 11:54:59] Ether / IP / TCP 204.79.197.203:https > 192.168.29.92:49817 A
[2025-06-15 11:54:59] Ether / IP / TCP 204.79.197.203:https > 192.168.29.92:49817 FA
[2025-06-15 11:54:59] Ether / IP / TCP 192.168.29.92:49817 > 204.79.197.203:https A
[2025-06-15 11:54:59] Ether / IP / TCP 204.79.197.203:https > 192.168.29.92:49821 A
[2025-06-15 11:54:59] Ether / IP / TCP 204.79.197.203:https > 192.168.29.92:49821 RA
[2025-06-15 11:55:02] Ether / IP / TCP 192.168.29.92:49738 > 35.162.53.240:https PA / Raw
[2025-06-15 11:55:02] Ether / IP / TCP 192.168.29.92:49738 > 35.162.53.240:https A / Raw
[2025-06-15 11:55:02] Ether / IP / TCP 192.168.29.92:49738 > 35.162.53.240:https A / Raw
[2025-06-15 11:55:02] Ether / IP / TCP 192.168.29.92:49738 > 35.162.53.240:https PA / Raw
[2025-06-15 11:55:02] Ether / IP / TCP 192.168.29.92:49835 > 35.162.53.240:https S
[2025-06-15 11:55:03] Ether / IP / TCP 35.162.53.240:https > 192.168.29.92:49738 A
[2025-06-15 11:55:03] Ether / IP / TCP 35.162.53.240:https > 192.168.29.92:49738 PA / Raw
[2025-06-15 11:55:03] Ether / IP / TCP 35.162.53.240:https > 192.168.29.92:49738 PA / Raw
[2025-06-15 11:55:03] Ether / IP / TCP 35.162.53.240:https > 192.168.29.92:49835 SA
[2025-06-15 11:55:03] Ether / IP / TCP 192.168.29.92:49738 > 35.162.53.240:https A
[2025-06-15 11:55:03] Ether / IP / TCP 192.168.29.92:49835 > 35.162.53.240:https A
[2025-06-15 11:55:03] Ether / IP / TCP 192.168.29.92:49835 > 35.162.53.240:https PA / Raw
[2025-06-15 11:55:03] Ether / IP / TCP 35.162.53.240:https > 192.168.29.92:49835 A
[2025-06-15 11:55:03] Ether / IP / TCP 35.162.53.240:https > 192.168.29.92:49835 A / Raw
[2025-06-15 11:55:03] Ether / IP / TCP 35.162.53.240:https > 192.168.29.92:49835 A / Raw
[2025-06-15 11:55:03] Ether / IP / TCP 35.162.53.240:https > 192.168.29.92:49835 PA / Raw
[2025-06-15 11:55:03] Ether / IP / TCP 192.168.29.92:49835 > 35.162.53.240:https A
[2025-06-15 11:55:03] Ether / IP / TCP 192.168.29.92:49835 > 35.162.53.240:https PA / Raw
[2025-06-15 11:55:03] Ether / IP / TCP 35.162.53.240:https > 192.168.29.92:49835 A
[2025-06-15 11:55:03] Ether / IP / TCP 35.162.53.240:https > 192.168.29.92:49835 PA / Raw
[2025-06-15 11:55:03] Ether / IP / TCP 35.162.53.240:https > 192.168.29.92:49835 PA / Raw
[2025-06-15 11:55:03] Ether / IP / TCP 192.168.29.92:49835 > 35.162.53.240:https A
[2025-06-15 11:55:03] Ether / IP / TCP 192.168.29.92:49835 > 35.162.53.240:https PA / Raw
[2025-06-15 11:55:03] Ether / IP / TCP 192.168.29.92:49835 > 35.162.53.240:https PA / Raw
[2025-06-15 11:55:03] Ether / IP / TCP 192.168.29.92:49835 > 35.162.53.240:https PA / Raw
[2025-06-15 11:55:03] Ether / IP / TCP 192.168.29.92:49835 > 35.162.53.240:https PA / Raw
[2025-06-15 11:55:04] Ether / IP / TCP 35.162.53.240:https > 192.168.29.92:49835 A
[2025-06-15 11:55:04] Ether / IP / TCP 35.162.53.240:https > 192.168.29.92:49835 PA / Raw
[2025-06-15 11:55:04] Ether / IP / TCP 35.162.53.240:https > 192.168.29.92:49835 PA / Raw
[2025-06-15 11:55:04] Ether / IP / TCP 35.162.53.240:https > 192.168.29.92:49835 PA / Raw
[2025-06-15 11:55:04] Ether / IP / TCP 192.168.29.92:49835 > 35.162.53.240:https A
[2025-06-15 11:55:04] Ether / IP / TCP 192.168.29.92:49835 > 35.162.53.240:https FA
[2025-06-15 11:55:04] Ether / IP / TCP 35.162.53.240:https > 192.168.29.92:49835 PA / Raw
[2025-06-15 11:55:04] Ether / IP / TCP 35.162.53.240:https > 192.168.29.92:49835 FA
[2025-06-15 11:55:04] Ether / IP / TCP 192.168.29.92:49835 > 35.162.53.240:https RA
[2025-06-15 11:55:06] Ether / IP / TCP 192.168.29.92:49837 > 13.107.6.158:https S
[2025-06-15 11:55:06] Ether / IP / TCP 13.107.6.158:https > 192.168.29.92:49837 SA
[2025-06-15 11:55:06] Ether / IP / TCP 192.168.29.92:49837 > 13.107.6.158:https A
[2025-06-15 11:55:06] Ether / IP / TCP 192.168.29.92:49837 > 13.107.6.158:https PA / Raw
[2025-06-15 11:55:06] Ether / IP / TCP 13.107.6.158:https > 192.168.29.92:49837 A
[2025-06-15 11:55:06] Ether / IP / TCP 13.107.6.158:https > 192.168.29.92:49837 A / Raw
[2025-06-15 11:55:06] Ether / IP / TCP 13.107.6.158:https > 192.168.29.92:49837 A / Raw
[2025-06-15 11:55:06] Ether / IP / TCP 13.107.6.158:https > 192.168.29.92:49837 PA / Raw
[2025-06-15 11:55:06] Ether / IP / TCP 192.168.29.92:49837 > 13.107.6.158:https A
[2025-06-15 11:55:06] Ether / IP / TCP 192.168.29.92:49837 > 13.107.6.158:https PA / Raw
[2025-06-15 11:55:06] Ether / IP / TCP 13.107.6.158:https > 192.168.29.92:49837 A
[2025-06-15 11:55:06] Ether / IP / TCP 13.107.6.158:https > 192.168.29.92:49837 PA / Raw
[2025-06-15 11:55:06] Ether / IP / TCP 192.168.29.92:49837 > 13.107.6.158:https A / Raw
[2025-06-15 11:55:06] Ether / IP / TCP 192.168.29.92:49837 > 13.107.6.158:https A / Raw
[2025-06-15 11:55:06] Ether / IP / TCP 192.168.29.92:49837 > 13.107.6.158:https PA / Raw
[2025-06-15 11:55:06] Ether / IP / TCP 13.107.6.158:https > 192.168.29.92:49837 A
[2025-06-15 11:55:07] Ether / IP / TCP 13.107.6.158:https > 192.168.29.92:49837 PA / Raw
[2025-06-15 11:55:07] Ether / IP / TCP 13.107.6.158:https > 192.168.29.92:49837 A / Raw
[2025-06-15 11:55:07] Ether / IP / TCP 13.107.6.158:https > 192.168.29.92:49837 PA / Raw
[2025-06-15 11:55:07] Ether / IP / TCP 192.168.29.92:49837 > 13.107.6.158:https A
[2025-06-15 11:55:07] Ether / IP / TCP 192.168.29.92:49838 > 13.107.6.158:https S
[2025-06-15 11:55:07] Ether / IP / TCP 13.107.6.158:https > 192.168.29.92:49838 SA
[2025-06-15 11:55:07] Ether / IP / TCP 192.168.29.92:49838 > 13.107.6.158:https A
[2025-06-15 11:55:07] Ether / IP / TCP 192.168.29.92:49838 > 13.107.6.158:https PA / Raw
[2025-06-15 11:55:07] Ether / IP / TCP 13.107.6.158:https > 192.168.29.92:49838 A
[2025-06-15 11:55:07] Ether / IP / TCP 13.107.6.158:https > 192.168.29.92:49838 A / Raw
[2025-06-15 11:55:07] Ether / IP / TCP 13.107.6.158:https > 192.168.29.92:49838 PA / Raw
[2025-06-15 11:55:07] Ether / IP / TCP 192.168.29.92:49838 > 13.107.6.158:https A
[2025-06-15 11:55:07] Ether / IP / TCP 192.168.29.92:49838 > 13.107.6.158:https PA / Raw
[2025-06-15 11:55:07] Ether / IP / TCP 192.168.29.92:49838 > 13.107.6.158:https A / Raw
[2025-06-15 11:55:07] Ether / IP / TCP 192.168.29.92:49838 > 13.107.6.158:https A / Raw
[2025-06-15 11:55:07] Ether / IP / TCP 192.168.29.92:49838 > 13.107.6.158:https PA / Raw
[2025-06-15 11:55:07] Ether / IP / TCP 13.107.6.158:https > 192.168.29.92:49838 A
[2025-06-15 11:55:07] Ether / IP / TCP 13.107.6.158:https > 192.168.29.92:49838 PA / Raw
[2025-06-15 11:55:07] Ether / IP / TCP 13.107.6.158:https > 192.168.29.92:49838 A
[2025-06-15 11:55:07] Ether / IP / TCP 192.168.29.92:49838 > 13.107.6.158:https A
[2025-06-15 11:55:08] Ether / IP / TCP 13.107.6.158:https > 192.168.29.92:49838 PA / Raw
[2025-06-15 11:55:08] Ether / IP / TCP 192.168.29.92:49838 > 13.107.6.158:https A
[2025-06-15 11:55:08] Ether / IP / TCP 192.168.29.92:49839 > 216.137.52.116:https S
[2025-06-15 11:55:08] Ether / IP / TCP 216.137.52.116:https > 192.168.29.92:49839 SA
[2025-06-15 11:55:08] Ether / IP / TCP 192.168.29.92:49839 > 216.137.52.116:https A
[2025-06-15 11:55:08] Ether / IP / TCP 192.168.29.92:49839 > 216.137.52.116:https PA / Raw
[2025-06-15 11:55:08] Ether / IP / TCP 216.137.52.116:https > 192.168.29.92:49839 A
[2025-06-15 11:55:08] Ether / IP / TCP 216.137.52.116:https > 192.168.29.92:49839 A / Raw
[2025-06-15 11:55:08] Ether / IP / TCP 216.137.52.116:https > 192.168.29.92:49839 PA / Raw
[2025-06-15 11:55:08] Ether / IP / TCP 192.168.29.92:49839 > 216.137.52.116:https A
[2025-06-15 11:55:08] Ether / IP / TCP 216.137.52.116:https > 192.168.29.92:49839 A / Raw
[2025-06-15 11:55:08] Ether / IP / TCP 216.137.52.116:https > 192.168.29.92:49839 A / Raw
[2025-06-15 11:55:08] Ether / IP / TCP 216.137.52.116:https > 192.168.29.92:49839 PA / Raw
[2025-06-15 11:55:08] Ether / IP / TCP 192.168.29.92:49839 > 216.137.52.116:https A
[2025-06-15 11:55:08] Ether / IP / TCP 192.168.29.92:49839 > 216.137.52.116:https PA / Raw
[2025-06-15 11:55:08] Ether / IP / TCP 216.137.52.116:https > 192.168.29.92:49839 A
[2025-06-15 11:55:08] Ether / IP / TCP 216.137.52.116:https > 192.168.29.92:49839 PA / Raw
[2025-06-15 11:55:08] Ether / IP / TCP 216.137.52.116:https > 192.168.29.92:49839 PA / Raw
[2025-06-15 11:55:08] Ether / IP / TCP 192.168.29.92:49839 > 216.137.52.116:https A
[2025-06-15 11:55:08] Ether / IP / TCP 192.168.29.92:49839 > 216.137.52.116:https PA / Raw
[2025-06-15 11:55:08] Ether / IP / TCP 192.168.29.92:49839 > 216.137.52.116:https PA / Raw
[2025-06-15 11:55:08] Ether / IP / TCP 192.168.29.92:49839 > 216.137.52.116:https PA / Raw
[2025-06-15 11:55:08] Ether / IP / TCP 192.168.29.92:49839 > 216.137.52.116:https PA / Raw
[2025-06-15 11:55:09] Ether / IP / TCP 216.137.52.116:https > 192.168.29.92:49839 A
[2025-06-15 11:55:09] Ether / IP / TCP 216.137.52.116:https > 192.168.29.92:49839 PA / Raw
[2025-06-15 11:55:09] Ether / IP / TCP 192.168.29.92:49839 > 216.137.52.116:https A
[2025-06-15 11:55:09] Ether / IP / TCP 216.137.52.116:https > 192.168.29.92:49839 A / Raw
[2025-06-15 11:55:09] Ether / IP / TCP 216.137.52.116:https > 192.168.29.92:49839 PA / Raw
[2025-06-15 11:55:09] Ether / IP / TCP 192.168.29.92:49839 > 216.137.52.116:https A
[2025-06-15 11:55:09] Ether / IP / TCP 216.137.52.116:https > 192.168.29.92:49839 PA / Raw
[2025-06-15 11:55:09] Ether / IP / TCP 192.168.29.92:49839 > 216.137.52.116:https FA
[2025-06-15 11:55:09] Ether / IP / TCP 192.168.29.92:49840 > 35.162.53.240:https S
[2025-06-15 11:55:09] Ether / IP / TCP 216.137.52.116:https > 192.168.29.92:49839 FA
[2025-06-15 11:55:09] Ether / IP / TCP 192.168.29.92:49839 > 216.137.52.116:https A
[2025-06-15 11:55:09] Ether / IP / TCP 35.162.53.240:https > 192.168.29.92:49840 SA
[2025-06-15 11:55:09] Ether / IP / TCP 192.168.29.92:49840 > 35.162.53.240:https A
[2025-06-15 11:55:09] Ether / IP / TCP 192.168.29.92:49840 > 35.162.53.240:https PA / Raw
[2025-06-15 11:55:09] Ether / IP / TCP 35.162.53.240:https > 192.168.29.92:49840 A
[2025-06-15 11:55:09] Ether / IP / TCP 35.162.53.240:https > 192.168.29.92:49840 A / Raw
[2025-06-15 11:55:09] Ether / IP / TCP 35.162.53.240:https > 192.168.29.92:49840 A / Raw
[2025-06-15 11:55:09] Ether / IP / TCP 35.162.53.240:https > 192.168.29.92:49840 PA / Raw
[2025-06-15 11:55:09] Ether / IP / TCP 192.168.29.92:49840 > 35.162.53.240:https A
[2025-06-15 11:55:09] Ether / IP / TCP 192.168.29.92:49840 > 35.162.53.240:https PA / Raw
[2025-06-15 11:55:10] Ether / IP / TCP 35.162.53.240:https > 192.168.29.92:49840 A
[2025-06-15 11:55:10] Ether / IP / TCP 35.162.53.240:https > 192.168.29.92:49840 PA / Raw
[2025-06-15 11:55:10] Ether / IP / TCP 35.162.53.240:https > 192.168.29.92:49840 PA / Raw
[2025-06-15 11:55:10] Ether / IP / TCP 192.168.29.92:49840 > 35.162.53.240:https A
[2025-06-15 11:55:10] Ether / IP / TCP 192.168.29.92:49840 > 35.162.53.240:https PA / Raw
[2025-06-15 11:55:10] Ether / IP / TCP 192.168.29.92:49840 > 35.162.53.240:https PA / Raw
[2025-06-15 11:55:10] Ether / IP / TCP 192.168.29.92:49840 > 35.162.53.240:https PA / Raw
[2025-06-15 11:55:10] Ether / IP / TCP 192.168.29.92:49840 > 35.162.53.240:https PA / Raw
[2025-06-15 11:55:10] Ether / IP / TCP 35.162.53.240:https > 192.168.29.92:49840 A
[2025-06-15 11:55:10] Ether / IP / TCP 35.162.53.240:https > 192.168.29.92:49840 PA / Raw
[2025-06-15 11:55:10] Ether / IP / TCP 35.162.53.240:https > 192.168.29.92:49840 PA / Raw
[2025-06-15 11:55:10] Ether / IP / TCP 35.162.53.240:https > 192.168.29.92:49840 PA / Raw
[2025-06-15 11:55:10] Ether / IP / TCP 192.168.29.92:49840 > 35.162.53.240:https A
[2025-06-15 11:55:10] Ether / IP / TCP 192.168.29.92:49840 > 35.162.53.240:https FA
[2025-06-15 11:55:10] Ether / IP / TCP 35.162.53.240:https > 192.168.29.92:49840 PA / Raw
[2025-06-15 11:55:10] Ether / IP / TCP 35.162.53.240:https > 192.168.29.92:49840 FA
[2025-06-15 11:55:10] Ether / IP / TCP 192.168.29.92:49840 > 35.162.53.240:https RA
[2025-06-15 12:12:05] Ether / 192.168.29.92 > 224.0.0.22 2 / Raw
[2025-06-15 12:13:20] Ether / IP / TCP 20.42.65.93:https > 192.168.29.92:50283 A
[2025-06-15 12:13:22] Ether / 192.168.29.92 > 224.0.0.22 2 / Raw
[2025-06-15 12:13:23] Ether / IP / TCP 104.199.241.202:4070 > 192.168.29.92:49857 PA / Raw
[2025-06-15 12:13:23] Ether / IP / TCP 192.168.29.92:49857 > 104.199.241.202:4070 A
[2025-06-15 12:13:25] Ether / IP / UDP 192.168.29.92:57621 > 192.168.29.255:57621 / Raw
[2025-06-15 12:13:27] Ether / IP / UDP 192.168.29.1:60784 > 192.168.29.92:echo / Raw
[2025-06-15 12:13:34] Ether / IP / TCP 192.168.29.92:50290 > 192.168.29.1:domain S
[2025-06-15 12:13:34] Ether / IP / TCP 192.168.29.92:50291 > 192.168.29.1:domain S
[2025-06-15 12:13:34] Ether / IP / TCP 192.168.29.92:50292 > 192.168.29.1:domain S
[2025-06-15 12:13:35] Ether / IP / TCP 192.168.29.92:50290 > 192.168.29.1:domain S
[2025-06-15 12:13:35] Ether / IP / TCP 192.168.29.92:50291 > 192.168.29.1:domain S
[2025-06-15 12:13:35] Ether / IP / TCP 192.168.29.92:50292 > 192.168.29.1:domain S
[2025-06-15 12:13:35] Ether / IP / TCP 192.168.29.92:49888 > 13.89.179.10:https A / Raw
[2025-06-15 12:13:36] Ether / IP / TCP 13.89.179.10:https > 192.168.29.92:49888 A
[2025-06-15 12:13:37] Ether / IP / TCP 192.168.29.92:50290 > 192.168.29.1:domain S
[2025-06-15 12:13:37] Ether / IP / TCP 192.168.29.92:50291 > 192.168.29.1:domain S
[2025-06-15 12:13:37] Ether / IP / TCP 192.168.29.92:50292 > 192.168.29.1:domain S
[2025-06-15 12:13:38] Ether / 192.168.29.1 > 224.0.0.1 2 / Raw
[2025-06-15 12:13:39] Ether / IP / TCP 192.168.29.92:50300 > 192.168.29.1:domain S
[2025-06-15 12:13:39] Ether / IP / TCP 192.168.29.92:50301 > 192.168.29.1:domain S
[2025-06-15 12:13:39] Ether / IP / TCP 192.168.29.92:50302 > 192.168.29.1:domain S
[2025-06-15 12:13:40] Ether / IP / TCP 192.168.29.92:49888 > 13.89.179.10:https PA / Raw
[2025-06-15 12:13:40] Ether / IP / TCP 192.168.29.92:49888 > 13.89.179.10:https PA / Raw
[2025-06-15 12:13:40] Ether / IP / TCP 192.168.29.92:49888 > 13.89.179.10:https A / Raw
[2025-06-15 12:13:40] Ether / IP / TCP 192.168.29.92:49888 > 13.89.179.10:https A / Raw
[2025-06-15 12:13:40] Ether / IP / TCP 192.168.29.92:49888 > 13.89.179.10:https A / Raw
[2025-06-15 12:13:40] Ether / IP / TCP 192.168.29.92:49888 > 13.89.179.10:https A / Raw
[2025-06-15 12:13:40] Ether / IP / TCP 192.168.29.92:49888 > 13.89.179.10:https A / Raw
[2025-06-15 12:13:40] Ether / IP / TCP 192.168.29.92:49888 > 13.89.179.10:https A / Raw
[2025-06-15 12:13:40] Ether / IP / TCP 192.168.29.92:49888 > 13.89.179.10:https A / Raw
[2025-06-15 12:13:40] Ether / IP / TCP 192.168.29.92:49888 > 13.89.179.10:https A / Raw
[2025-06-15 12:13:40] Ether / IP / TCP 192.168.29.92:49888 > 13.89.179.10:https A / Raw
[2025-06-15 12:13:40] Ether / IP / TCP 192.168.29.92:49888 > 13.89.179.10:https A / Raw
[2025-06-15 12:13:40] Ether / IP / TCP 192.168.29.92:49888 > 13.89.179.10:https A / Raw
[2025-06-15 12:13:40] Ether / IP / TCP 192.168.29.92:49888 > 13.89.179.10:https PA / Raw
[2025-06-15 12:13:40] Ether / IP / TCP 192.168.29.92:49888 > 13.89.179.10:https PA / Raw
[2025-06-15 12:13:40] Ether / IP / TCP 13.89.179.10:https > 192.168.29.92:49888 A
[2025-06-15 12:13:40] Ether / IP / TCP 13.89.179.10:https > 192.168.29.92:49888 PA / Raw
[2025-06-15 12:13:40] Ether / IP / TCP 13.89.179.10:https > 192.168.29.92:49888 A
[2025-06-15 12:13:40] Ether / IP / TCP 13.89.179.10:https > 192.168.29.92:49888 A
[2025-06-15 12:13:40] Ether / IP / TCP 13.89.179.10:https > 192.168.29.92:49888 PA / Raw
[2025-06-15 12:13:40] Ether / IP / TCP 192.168.29.92:49888 > 13.89.179.10:https A
[2025-06-15 12:13:40] Ether / IP / TCP 13.89.179.10:https > 192.168.29.92:49888 PA / Raw
[2025-06-15 12:13:40] Ether / IP / TCP 192.168.29.92:49888 > 13.89.179.10:https PA / Raw
[2025-06-15 12:13:40] Ether / IP / TCP 192.168.29.92:50300 > 192.168.29.1:domain S
[2025-06-15 12:13:40] Ether / IP / TCP 192.168.29.92:50301 > 192.168.29.1:domain S
[2025-06-15 12:13:40] Ether / IP / TCP 192.168.29.92:50302 > 192.168.29.1:domain S
[2025-06-15 12:13:41] Ether / IP / TCP 192.168.29.92:49888 > 13.89.179.10:https PA / Raw
[2025-06-15 12:13:41] Ether / IP / TCP 13.89.179.10:https > 192.168.29.92:49888 A
[2025-06-15 12:13:41] Ether / IP / TCP 13.89.179.10:https > 192.168.29.92:49888 A
[2025-06-15 12:13:41] Ether / IP / TCP 192.168.29.92:50290 > 192.168.29.1:domain S
[2025-06-15 12:13:41] Ether / IP / TCP 192.168.29.92:50291 > 192.168.29.1:domain S
[2025-06-15 12:13:41] Ether / IP / TCP 192.168.29.92:50292 > 192.168.29.1:domain S
[2025-06-15 12:13:41] Ether / IP / UDP 192.168.29.92:64083 > 239.255.255.250:ssdp / Raw
[2025-06-15 12:13:42] Ether / IP / TCP 192.168.29.92:49888 > 13.89.179.10:https PA / Raw
[2025-06-15 12:13:42] Ether / IP / TCP 192.168.29.92:49888 > 13.89.179.10:https A / Raw
[2025-06-15 12:13:42] Ether / IP / TCP 192.168.29.92:49888 > 13.89.179.10:https A / Raw
[2025-06-15 12:13:42] Ether / IP / TCP 192.168.29.92:49888 > 13.89.179.10:https A / Raw
[2025-06-15 12:13:42] Ether / IP / TCP 192.168.29.92:49888 > 13.89.179.10:https A / Raw
[2025-06-15 12:13:42] Ether / IP / TCP 192.168.29.92:49888 > 13.89.179.10:https A / Raw
[2025-06-15 12:13:42] Ether / IP / TCP 192.168.29.92:49888 > 13.89.179.10:https A / Raw
[2025-06-15 12:13:42] Ether / IP / TCP 192.168.29.92:49888 > 13.89.179.10:https A / Raw
[2025-06-15 12:13:42] Ether / IP / TCP 192.168.29.92:49888 > 13.89.179.10:https A / Raw
[2025-06-15 12:13:42] Ether / IP / TCP 192.168.29.92:49888 > 13.89.179.10:https A / Raw
[2025-06-15 12:13:42] Ether / IP / TCP 192.168.29.92:49888 > 13.89.179.10:https A / Raw
[2025-06-15 12:13:42] Ether / IP / TCP 192.168.29.92:49888 > 13.89.179.10:https A / Raw
[2025-06-15 12:13:42] Ether / IP / TCP 192.168.29.92:49888 > 13.89.179.10:https PA / Raw
[2025-06-15 12:13:42] Ether / IP / TCP 192.168.29.92:49888 > 13.89.179.10:https PA / Raw
[2025-06-15 12:13:42] Ether / IP / TCP 13.89.179.10:https > 192.168.29.92:49888 A
[2025-06-15 12:13:42] Ether / IP / TCP 13.89.179.10:https > 192.168.29.92:49888 A
[2025-06-15 12:13:42] Ether / IP / TCP 13.89.179.10:https > 192.168.29.92:49888 A
[2025-06-15 12:13:42] Ether / IP / TCP 13.89.179.10:https > 192.168.29.92:49888 A
[2025-06-15 12:13:42] Ether / IP / TCP 13.89.179.10:https > 192.168.29.92:49888 PA / Raw
[2025-06-15 12:13:42] Ether / IP / TCP 192.168.29.92:49888 > 13.89.179.10:https A
[2025-06-15 12:13:42] Ether / 192.168.29.92 > 224.0.0.22 2 / Raw
[2025-06-15 12:13:43] Ether / IP / UDP 192.168.29.92:64083 > 239.255.255.250:ssdp / Raw
[2025-06-15 12:13:44] Ether / IP / UDP 192.168.29.92:64083 > 239.255.255.250:ssdp / Raw
[2025-06-15 12:13:44] Ether / IP / TCP 192.168.29.92:49888 > 13.89.179.10:https PA / Raw
[2025-06-15 12:13:44] Ether / IP / TCP 192.168.29.92:49888 > 13.89.179.10:https A / Raw
[2025-06-15 12:13:44] Ether / IP / TCP 192.168.29.92:49888 > 13.89.179.10:https A / Raw
[2025-06-15 12:13:44] Ether / IP / TCP 192.168.29.92:49888 > 13.89.179.10:https A / Raw
[2025-06-15 12:13:44] Ether / IP / TCP 192.168.29.92:49888 > 13.89.179.10:https A / Raw
[2025-06-15 12:13:44] Ether / IP / TCP 192.168.29.92:49888 > 13.89.179.10:https A / Raw
[2025-06-15 12:13:44] Ether / IP / TCP 192.168.29.92:49888 > 13.89.179.10:https A / Raw
[2025-06-15 12:13:44] Ether / IP / TCP 192.168.29.92:49888 > 13.89.179.10:https A / Raw
[2025-06-15 12:13:44] Ether / IP / TCP 192.168.29.92:49888 > 13.89.179.10:https A / Raw
[2025-06-15 12:13:44] Ether / IP / TCP 192.168.29.92:49888 > 13.89.179.10:https A / Raw
[2025-06-15 12:13:44] Ether / IP / TCP 192.168.29.92:49888 > 13.89.179.10:https PA / Raw
[2025-06-15 12:13:44] Ether / IP / TCP 13.89.179.10:https > 192.168.29.92:49888 A
[2025-06-15 12:13:44] Ether / IP / TCP 13.89.179.10:https > 192.168.29.92:49888 A
[2025-06-15 12:13:44] Ether / IP / TCP 13.89.179.10:https > 192.168.29.92:49888 A
[2025-06-15 12:13:44] Ether / IP / TCP 13.89.179.10:https > 192.168.29.92:49888 PA / Raw
[2025-06-15 12:13:44] Ether / IP / TCP 192.168.29.92:49888 > 13.89.179.10:https A
[2025-06-15 12:13:45] Ether / IP / UDP 192.168.29.92:64083 > 239.255.255.250:ssdp / Raw
[2025-06-15 12:13:46] Ether / 192.168.29.92 > 224.0.0.22 2 / Raw
[2025-06-15 12:13:46] Ether / IP / TCP 192.168.29.92:49888 > 13.89.179.10:https PA / Raw
[2025-06-15 12:13:46] Ether / IP / TCP 192.168.29.92:49888 > 13.89.179.10:https A / Raw
[2025-06-15 12:13:46] Ether / IP / TCP 192.168.29.92:49888 > 13.89.179.10:https A / Raw
[2025-06-15 12:13:46] Ether / IP / TCP 192.168.29.92:49888 > 13.89.179.10:https A / Raw
[2025-06-15 12:13:46] Ether / IP / TCP 192.168.29.92:49888 > 13.89.179.10:https A / Raw
[2025-06-15 12:13:46] Ether / IP / TCP 192.168.29.92:49888 > 13.89.179.10:https PA / Raw
[2025-06-15 12:13:47] Ether / IP / TCP 192.168.29.92:49888 > 13.89.179.10:https PA / Raw
[2025-06-15 12:13:47] Ether / IP / TCP 13.89.179.10:https > 192.168.29.92:49888 A
[2025-06-15 12:13:47] Ether / IP / TCP 13.89.179.10:https > 192.168.29.92:49888 A
[2025-06-15 12:13:47] Ether / IP / TCP 13.89.179.10:https > 192.168.29.92:49888 A
[2025-06-15 12:13:47] Ether / IP / TCP 13.89.179.10:https > 192.168.29.92:49888 PA / Raw
[2025-06-15 12:13:47] Ether / IP / TCP 192.168.29.92:49888 > 13.89.179.10:https PA / Raw
[2025-06-15 12:13:47] Ether / 192.168.29.92 > 224.0.0.22 2 / Raw
[2025-06-15 12:13:47] Ether / IP / TCP 13.89.179.10:https > 192.168.29.92:49888 A
[2025-06-15 12:13:47] Ether / IP / TCP 13.89.179.10:https > 192.168.29.92:49888 A
[2025-06-15 12:13:49] Ether / IP / TCP 192.168.29.92:49888 > 13.89.179.10:https PA / Raw
[2025-06-15 12:13:49] Ether / IP / TCP 192.168.29.92:49888 > 13.89.179.10:https A / Raw
[2025-06-15 12:13:49] Ether / IP / TCP 192.168.29.92:49888 > 13.89.179.10:https A / Raw
[2025-06-15 12:13:49] Ether / IP / TCP 192.168.29.92:49888 > 13.89.179.10:https A / Raw
[2025-06-15 12:13:49] Ether / IP / TCP 192.168.29.92:49888 > 13.89.179.10:https A / Raw
[2025-06-15 12:13:49] Ether / IP / TCP 192.168.29.92:49888 > 13.89.179.10:https PA / Raw
[2025-06-15 12:13:49] Ether / IP / TCP 13.89.179.10:https > 192.168.29.92:49888 A
[2025-06-15 12:13:49] Ether / IP / TCP 13.89.179.10:https > 192.168.29.92:49888 A
[2025-06-15 12:13:49] Ether / IP / TCP 13.89.179.10:https > 192.168.29.92:49888 PA / Raw
[2025-06-15 12:13:49] Ether / IP / TCP 192.168.29.92:49888 > 13.89.179.10:https A
[2025-06-15 12:13:51] Ether / IP / TCP 192.168.29.92:49888 > 13.89.179.10:https PA / Raw
[2025-06-15 12:13:51] Ether / IP / TCP 192.168.29.92:49888 > 13.89.179.10:https A / Raw
[2025-06-15 12:13:51] Ether / IP / TCP 192.168.29.92:49888 > 13.89.179.10:https A / Raw
[2025-06-15 12:13:51] Ether / IP / TCP 192.168.29.92:49888 > 13.89.179.10:https A / Raw
[2025-06-15 12:13:51] Ether / IP / TCP 192.168.29.92:49888 > 13.89.179.10:https PA / Raw
[2025-06-15 12:13:51] Ether / IP / TCP 13.89.179.10:https > 192.168.29.92:49888 A
[2025-06-15 12:13:51] Ether / IP / TCP 13.89.179.10:https > 192.168.29.92:49888 A
[2025-06-15 12:13:51] Ether / IP / TCP 13.89.179.10:https > 192.168.29.92:49888 PA / Raw
[2025-06-15 12:13:51] Ether / IP / TCP 192.168.29.92:49888 > 13.89.179.10:https A
[2025-06-15 12:13:53] Ether / IP / TCP 192.168.29.92:49888 > 13.89.179.10:https PA / Raw
[2025-06-15 12:13:53] Ether / IP / TCP 192.168.29.92:49888 > 13.89.179.10:https A / Raw
[2025-06-15 12:13:53] Ether / IP / TCP 192.168.29.92:49888 > 13.89.179.10:https A / Raw
[2025-06-15 12:13:53] Ether / IP / TCP 192.168.29.92:49888 > 13.89.179.10:https A / Raw
[2025-06-15 12:13:53] Ether / IP / TCP 192.168.29.92:49888 > 13.89.179.10:https A / Raw
[2025-06-15 12:13:53] Ether / IP / TCP 192.168.29.92:49888 > 13.89.179.10:https PA / Raw
[2025-06-15 12:13:53] Ether / IP / TCP 13.89.179.10:https > 192.168.29.92:49888 A
[2025-06-15 12:13:53] Ether / IP / TCP 13.89.179.10:https > 192.168.29.92:49888 PA / Raw
[2025-06-15 12:13:53] Ether / IP / TCP 192.168.29.92:49888 > 13.89.179.10:https PA / Raw
[2025-06-15 12:13:53] Ether / IP / TCP 13.89.179.10:https > 192.168.29.92:49888 A
[2025-06-15 12:13:55] Ether / IP / TCP 192.168.29.92:49888 > 13.89.179.10:https PA / Raw
[2025-06-15 12:13:55] Ether / IP / TCP 192.168.29.92:49888 > 13.89.179.10:https A / Raw
[2025-06-15 12:13:55] Ether / IP / TCP 192.168.29.92:49888 > 13.89.179.10:https A / Raw
[2025-06-15 12:13:55] Ether / IP / TCP 192.168.29.92:49888 > 13.89.179.10:https A / Raw
[2025-06-15 12:13:55] Ether / IP / TCP 192.168.29.92:49888 > 13.89.179.10:https A / Raw
[2025-06-15 12:13:55] Ether / IP / TCP 192.168.29.92:49888 > 13.89.179.10:https PA / Raw
[2025-06-15 12:13:55] Ether / IP / TCP 13.89.179.10:https > 192.168.29.92:49888 A
[2025-06-15 12:13:55] Ether / IP / TCP 13.89.179.10:https > 192.168.29.92:49888 A
[2025-06-15 12:13:55] Ether / IP / TCP 13.89.179.10:https > 192.168.29.92:49888 A
[2025-06-15 12:13:55] Ether / IP / TCP 13.89.179.10:https > 192.168.29.92:49888 PA / Raw
[2025-06-15 12:13:55] Ether / IP / TCP 192.168.29.92:49888 > 13.89.179.10:https A
[2025-06-15 12:13:55] Ether / IP / UDP 192.168.29.92:57621 > 192.168.29.255:57621 / Raw
[2025-06-15 12:27:47] IP / TCP 192.168.1.2:1234 > 192.168.1.10:http S
[2025-06-15 12:27:47] IP / UDP 10.0.0.5:5000 > 10.0.0.10:domain
[2025-06-15 12:27:47] IP / ICMP 8.8.8.8 > 192.168.1.1 echo-request 0
